{
  "$schema": "https://json-schema.org/draft/2020-12/schema",
  "$id": "experiment.schema.json",
  "type": "object",
  "additionalProperties": false,
  "required": [
    "id",
    "version",
    "suite",
    "tasks",
    "conditions",
    "scoring"
  ],
  "properties": {
    "id": {
      "type": "string",
      "minLength": 1
    },
    "version": {
      "type": "integer",
      "minimum": 1
    },
    "suite": {
      "type": "string",
      "minLength": 1
    },
    "tasks": {
      "type": "array",
      "minItems": 1,
      "uniqueItems": true,
      "items": {
        "type": "string",
        "minLength": 1
      }
    },
    "oracle_reviews": {
      "type": "string",
      "minLength": 1
    },
    "conditions": {
      "type": "array",
      "minItems": 1,
      "items": {
        "type": "object",
        "additionalProperties": false,
        "required": ["id", "subject", "agent", "trials"],
        "oneOf": [
          {"required": ["seed"]},
          {"required": ["replicate_ids"]}
        ],
        "properties": {
          "id": {
            "type": "string",
            "minLength": 1
          },
          "subject": {
            "type": "string",
            "minLength": 1
          },
          "agent": {
            "type": "string",
            "minLength": 1
          },
          "trials": {
            "type": "integer",
            "minimum": 1
          },
          "seed": {
            "type": "integer"
          },
          "replicate_ids": {
            "type": "array",
            "minItems": 1,
            "uniqueItems": true,
            "items": {"type": "integer"}
          }
        }
      }
    },
    "scoring": {
      "type": "object",
      "additionalProperties": false,
      "required": [
        "id",
        "version",
        "metrics"
      ],
      "properties": {
        "id": {
          "type": "string",
          "minLength": 1
        },
        "version": {
          "type": "integer",
          "minimum": 1
        },
        "metrics": {
          "type": "array",
          "minItems": 1,
          "uniqueItems": true,
          "items": {
            "type": "string",
            "minLength": 1
          }
        }
      }
    }
  }
}
